{
  "$schema": "https://json-schema.org/draft/2020-12/schema",
  "type": "object",
  "additionalProperties": false,
  "required": [
    "summary",
    "description",
    "tags",
    "origin",
    "license",
    "author"
  ],
  "properties": {
    "summary": {
      "type": "string",
      "minLength": 1,
      "maxLength": 120
    },
    "description": {
      "type": "string",
      "minLength": 1
    },
    "tags": {
      "type": "array",
      "minItems": 1,
      "items": {
        "type": "string",
        "pattern": "^[a-z0-9][a-z0-9-]*$"
      }
    },
    "origin": {
      "enum": [
        "appdevforall",
        "community"
      ]
    },
    "license": {
      "type": "string",
      "minLength": 1
    },
    "author": {
      "type": "object",
      "additionalProperties": false,
      "required": [
        "name",
        "url"
      ],
      "properties": {
        "name": {
          "type": "string",
          "minLength": 1
        },
        "url": {
          "type": "string"
        },
        "email": {
          "type": "string"
        }
      }
    },
    "template": {
      "$comment": "Template addons only (ADFA-6252). A template has no AndroidManifest.xml, so the three values a plugin keeps as <meta-data> live here. check.py requires this object for an addon under templates/ and model.py reads it in place of the manifest. A plugin must not carry it.",
      "type": "object",
      "additionalProperties": false,
      "required": [
        "id",
        "version",
        "minAppVersion"
      ],
      "properties": {
        "id": {
          "$comment": "Unique, and never changed across releases.",
          "type": "string",
          "minLength": 1
        },
        "version": {
          "type": "string",
          "pattern": "^[0-9]+(\\.[0-9]+)*$"
        },
        "minAppVersion": {
          "$comment": "A YY.ww Code on the Go release, e.g. 26.38.",
          "type": "string",
          "pattern": "^[0-9]{2}\\.[0-9]{2}$"
        }
      }
    }
  }
}
