{
  "summary": "Searches the project by meaning, not only by exact text.",
  "description": "Ranks search results by how close their meaning is to the words you typed, so you find related code that a plain text search would miss. Needs AI Core and an agent plugin whose backend produces embeddings.",
  "tags": [
    "search",
    "ai",
    "navigation"
  ],
  "origin": "appdevforall",
  "license": "AGPL-3.0-or-later",
  "author": {
    "name": "App Dev For All",
    "url": "https://www.appdevforall.org"
  }
}
